{
  "event_id": "evt_example",
  "event_type": "run.accepted",
  "schema_version": 1,
  "occurred_at": "2026-09-04T00:00:00Z",
  "workspace_id": "ws_example",
  "aggregate_id": "run_example",
  "aggregate_version": 1,
  "trace_id": "trace_example",
  "payload": {
    "execution_state": "queued",
    "billing_state": "reserved"
  }
}
